{
  "$schema": "http://json-schema.org/draft-04/schema#",
  "type": "object",
  "additionalProperties": false,
  "required": ["email", "password"],
  "properties": {
    "email": {
      "type": "string",
      "format": "email"
    },
    "id": {
      "type": "string"
    },
    "name": {
      "type": "string",
      "default": ""
    },
    "password": {
      "type": "string"
    }
  }
}